{
  "spec_version": 2,
  "run_id": "compile-emit-barrier-join",
  "tenant_id": "t_fixture",
  "repo_id": "r_fixture",
  "agent_roles": [{ "name": "planner" }],
  "orchestration_bindings": [
    {
      "role_name": "planner",
      "agent_name": "compile_controller",
      "orchestration_step_ids": ["workflow_000", "workflow_001", "workflow_002"]
    }
  ],
  "coordination_graph": {
    "nodes": [
      { "node_id": "workflow_000", "kind": "step" },
      { "node_id": "workflow_001", "kind": "step" },
      { "node_id": "workflow_002", "kind": "step" }
    ],
    "edges": [
      {
        "edge_id": "edge_0001",
        "kind": "barrier",
        "src_step_id": "workflow_000",
        "dst_step_id": "workflow_002"
      },
      {
        "edge_id": "edge_0002",
        "kind": "barrier",
        "src_step_id": "workflow_001",
        "dst_step_id": "workflow_002"
      }
    ]
  }
}
